{
  "a10Reevaluation": {
    "blockers": [
      "TASK-A07 contains unresolved anatomical identities; the same-subject TASK-AS06 superficial-vessel search found no track meeting fixed continuity gates, so the venous_access_target remains intentionally unnamed",
      "TASK-A08 required vessel centerlines remain unavailable for structure.radial_artery.left and the unresolved superficial target vein; the bounded ulnar artery centerline candidate remains the accepted source-supported representation",
      "TASK-A09 required boundary/lumen representations remain unavailable for structure.radial_artery.left and the unresolved superficial target vein; the bounded ulnar artery topology candidate remains the accepted source-supported representation",
      "required semantic identities lack candidate representations: structure.radial_artery.left",
      "TASK-AS06 same-subject branch-topology search did not establish radial/brachial/bifurcation identity, and the wider same-subject superficial search did not establish a named target vein; automatic atlas-based or procedure-role substitution remains prohibited",
      "TASK-V09 independently re-evaluated radial-artery, subject-scoped superficial-structure, and named-superficial identity promotion gates; only passed claim-level gates may feed into M8A.",
      "TASK-V09 radial-artery promotion gate remains blocked-unresolved; no radial identity or representation is injected into A07/A08/A09.",
      "TASK-V09 subject-scoped superficial-structure promotion gate remains blocked-unresolved; no superficial target identity or representation is injected into A07/A08/A09.",
      "Existing source-supported ulnar A07/A08/A09 work is preserved without expanding its named identity, extent, validation level, or coordinate-space claims."
    ],
    "medicalMasterCreationAllowed": false,
    "priorStatus": "blocked",
    "status": "blocked"
  },
  "claims": {
    "automaticPromotionAllowed": false,
    "existingUlnarEvidencePreserved": true,
    "medicalMasterCreated": false,
    "medicalValidation": false,
    "newGeometryPromoted": false,
    "newNamedSuperficialVeinIdentityApplied": false,
    "newRadialIdentityApplied": false,
    "newSuperficialStructureIdentityApplied": false,
    "patientSpaceGeometry": false,
    "procedureRoleUsedAsAnatomicalIdentity": false
  },
  "feedForwardActions": {
    "namedSuperficialVein": {
      "blockers": [
        "superficial.gate.direct-extent",
        "superficial.gate.continuity",
        "superficial.gate.subcutaneous-relationship",
        "superficial.gate.vein-class",
        "superficial.gate.competitor-resolution",
        "superficial.gate.human-review",
        "superficial.structure.observed",
        "superficial.identity.named-topology",
        "superficial.identity.named",
        "no single reviewed target is present across required claims",
        "one or more required claim-level gates do not pass"
      ],
      "geometryPromotionApplied": false,
      "identityClaimStatus": "blocked",
      "procedureRoleUsedAsIdentity": false,
      "targetId": null
    },
    "radialArtery": {
      "blockers": [
        "radial.gate.same-subject-anchor",
        "radial.gate.continuity",
        "radial.gate.branch-topology",
        "radial.gate.landmark-relationships",
        "radial.gate.competitor-resolution",
        "radial.gate.human-review",
        "no single reviewed target is present across required claims",
        "one or more required claim-level gates do not pass"
      ],
      "existingA07RepresentationAvailable": false,
      "existingA08CenterlineStatus": "blocked",
      "existingA09RepresentationStatus": "blocked",
      "geometryPromotionApplied": false,
      "identityClaimStatus": "blocked",
      "targetId": null
    },
    "superficialStructure": {
      "blockers": [
        "superficial.gate.direct-extent",
        "superficial.gate.continuity",
        "superficial.gate.subcutaneous-relationship",
        "superficial.gate.vein-class",
        "superficial.gate.competitor-resolution",
        "superficial.gate.human-review",
        "no single reviewed target is present across required claims",
        "one or more required claim-level gates do not pass"
      ],
      "existingA07AnatomicalId": null,
      "existingA08CenterlineStatus": "blocked",
      "existingA09RepresentationStatus": "blocked",
      "geometryPromotionApplied": false,
      "identityClaimStatus": "blocked",
      "targetId": null
    }
  },
  "gateV": {
    "a10Reevaluated": true,
    "allPassedClaimsFedWithoutGeometryFabrication": true,
    "outcome": "fail-closed-documented",
    "status": "complete",
    "unresolvedClaimsRemainBlocked": true
  },
  "preservedExistingEvidence": [
    {
      "a07RepresentationAvailable": true,
      "a08CenterlineStatus": "generated",
      "a09RepresentationStatus": "generated",
      "anatomicalId": "structure.ulnar_artery.left",
      "scope": "existing bounded source-supported representation only"
    }
  ],
  "promotionInput": {
    "anyPromotionGatePassed": false,
    "namedSuperficialVein": {
      "blockingClaimIds": [
        "superficial.gate.direct-extent",
        "superficial.gate.continuity",
        "superficial.gate.subcutaneous-relationship",
        "superficial.gate.vein-class",
        "superficial.gate.competitor-resolution",
        "superficial.gate.human-review",
        "superficial.structure.observed",
        "superficial.identity.named-topology",
        "superficial.identity.named"
      ],
      "blockingReasons": [
        "no single reviewed target is present across required claims",
        "one or more required claim-level gates do not pass"
      ],
      "promotionGatePassed": false,
      "targetId": null
    },
    "radialArtery": {
      "blockingClaimIds": [
        "radial.gate.same-subject-anchor",
        "radial.gate.continuity",
        "radial.gate.branch-topology",
        "radial.gate.landmark-relationships",
        "radial.gate.competitor-resolution",
        "radial.gate.human-review"
      ],
      "blockingReasons": [
        "no single reviewed target is present across required claims",
        "one or more required claim-level gates do not pass"
      ],
      "promotionGatePassed": false,
      "targetId": null
    },
    "superficialStructure": {
      "blockingClaimIds": [
        "superficial.gate.direct-extent",
        "superficial.gate.continuity",
        "superficial.gate.subcutaneous-relationship",
        "superficial.gate.vein-class",
        "superficial.gate.competitor-resolution",
        "superficial.gate.human-review"
      ],
      "blockingReasons": [
        "no single reviewed target is present across required claims",
        "one or more required claim-level gates do not pass"
      ],
      "promotionGatePassed": false,
      "targetId": null
    }
  },
  "recordedAt": "2026-09-11",
  "schema": "ph-m8v-m8a-feed-forward.v1",
  "schemaVersion": "1",
  "sourceEvidence": [
    {
      "path": "authoring/outputs/m8v-v09-identity-promotion-evaluation-20260911.json",
      "role": "m8v-promotion-evaluation",
      "schema": "ph-m8v-identity-promotion-evaluation.v1",
      "sha256": "edb2e627983de28e1b7085ec3f01978fbc8b3cea5fb997fe8203470673edfc7e"
    },
    {
      "path": "authoring/outputs/as07-continuity-feed-forward-20260910.json",
      "role": "prior-m8a-feed-forward",
      "schema": "ph-as07-continuity-feed-forward.v1",
      "sha256": "fcc124b5304804c479a5e79550a30fc06656b307ddb63d1610562498a46f2054"
    },
    {
      "path": "authoring/semantic/a07-semantic-structure-mapping-20260910.json",
      "role": "a07-semantic-mapping",
      "schema": "ph-semantic-structure-mapping.v1",
      "sha256": "4af16c3c1ffc6c1a62bae40e766e388b8927f2ee03db7953b266d0ae16cd4271"
    },
    {
      "path": "authoring/outputs/a08-vessel-centerline-authoring-report-20260910.json",
      "role": "a08-centerline-report",
      "schema": "ph-vessel-centerline-authoring-report.v1",
      "sha256": "560f2708e7d97431dba0295011e6027fff1a981f9a2c07ae2def80347a813fe3"
    },
    {
      "path": "authoring/outputs/a09-boundary-lumen-authoring-report-20260910.json",
      "role": "a09-boundary-lumen-report",
      "schema": "ph-boundary-lumen-authoring-report.v1",
      "sha256": "6ba367c7e92423cbbd58b1a5fb06c6b352c8b5fb9235c425ce89a5d2758aa083"
    },
    {
      "path": "authoring/outputs/a10-medical-master-readiness-20260910.json",
      "role": "a10-readiness-record",
      "schema": "ph-medical-master-readiness.v1",
      "sha256": "594e505ddf5a69c81f7319f61fdf961f00d7872e46070299d2c7e3e05d2af5aa"
    }
  ],
  "status": "complete",
  "task": "TASK-V10"
}
